{
  "schema_version": "1.0",
  "id": "demo_dyngen_scrna_grouped",
  "profile": "scrna_grouped",
  "organism": {
    "kind": "synthetic",
    "tax_id": null,
    "name": "synthetic dyngen"
  },
  "requested_extras": [
    "lineage_tree",
    "tf_list"
  ],
  "base_seed": 2001,
  "notes": "Small dyngen scrna_grouped demo with derived groups, lineage_tree and tf_list."
}
