{
  "schema_version": "1.0",
  "id": "demo_dyngen_scrna_global",
  "profile": "scrna_global",
  "organism": {
    "kind": "synthetic",
    "tax_id": null,
    "name": "synthetic dyngen"
  },
  "requested_extras": [
    "tf_list"
  ],
  "base_seed": 1001,
  "notes": "Small dyngen scrna_global demo for generate-v2 CLI testing."
}
